,brand,price,seller,maker
0,Chaussures de randonnée imperméables Vals Mid de The North Face - Hommes,110.49,mec,North Face
1,Chaussures course sur sentier Zoom Pegasus 36 GTX de Nike - Hommes,200.0,mec,Nike
2,Sandales Newport H2 de Keen - Hommes,119.95,mec,Keen
3,Chaussures de courte randonnée Moab 2 Ventilator de Merrell - Hommes,139.95,mec,Merrel
4,Chaussures Moab Adventure Lace de Merrell - Hommes,159.95,mec,Merrel
5,Chaussures de course sur route Escalante 1.5 de Altra - Hommes,125.97,mec,Altra
6,Chaussures de courte randonnée Bridger Low de Oboz - Hommes,184.95,mec,Oboz
7,Chaussures Fiery GORE-TEX de Merrell - Hommes,159.95,mec,Merrel
8,Chaussures de course sur route GT-2000 7 de Asics - Hommes,88.37,mec,Asics
9,Chaussures Ascent Ride GORE-TEX de Merrell - Hommes,125.97,mec,Merrel
10,Chaussures imperméables Citizen Evo de Keen - Hommes,119.97,mec,Keen
11,Chaussures FiveFingers KSO EVO de Vibram - Hommes,129.95,mec,Other
12,Chaussures Austin de Keen - Hommes,149.95,mec,Keen
13,Chaussures Circuit de Black Diamond - Hommes,129.95,mec,Other
14,Chaussures de randonnée légère Breeze LT Mid GTX de Vasque - Hommes,99.98,mec,Other
15,Chaussures de course Wave Rider GTX de Mizuno - Hommes,113.97,mec,Other
16,Chaussures de course sur route Ghost 12 de Brooks - Hommes,169.95,mec,Brooks
17,Chaussures de randonnée imperméables Targhee II Mid de Keen - Hommes,179.95,mec,Keen
18,Chaussures de courte randonnée Breeze LT Low GTX de Vasque - Hommes,189.95,mec,Other
19,Chaussures Session de Black Diamond - Hommes,154.95,mec,Other
20,Chaussures de course sur sentier Sense Ride 2 de Salomon - Hommes,89.97,mec,Salomon
21,Chaussures de course sur route Sonic RA Pro 2 de Salomon - Hommes,79.98,mec,Salomon
22,Chaussures d'approche Mojito de Scarpa - Hommes,179.95,mec,Scarpa
23,Chaussures de randonnée légère Sawtooth II Low de Oboz - Hommes,149.95,mec,Oboz
24,Chaussures d'approche Konseal FL GTX de Arc'teryx - Hommes,219.95,mec,Other
25,Chaussures Ultra Fastpack III GORE-TEX Woven de The North Face - Hommes,164.99,mec,North Face
26,Chaussures Margarita GTX de Scarpa - Hommes,139.97,mec,Scarpa
27,Chaussures de course sur sentier Norvan LD 2 GTX de Arc'teryx - Hommes,219.95,mec,Other
28,Chaussures de course sur route GT-1000 7 de Asics - Hommes,109.99,mec,Asics
29,Chaussures imperméables Phil Mid de Forsake - Hommes,174.95,mec,Forsake
30,Chaussures d'entraînement Solstice de Altra - Hommes,77.97,mec,Altra
31,Chaussures de course sur route Air Zoom Pegasus 36 de Nike - Hommes,154.95,mec,Nike
32,Chaussures de sport Soft 7 Tred GORE-TEX de Ecco - Hommes,157.47,mec,Other
33,Chaussures de course sur sentier Ultra Pro de Salomon - Hommes,118.97,mec,Salomon
34,Chaussures de course Oribi5 BUGrip Traction de Icebug - Hommes,136.47,mec,Other
35,Chaussures de randonnée OUTline Mid GORE-TEX de Salomon - Hommes,179.95,mec,Salomon
36,Chaussures de course sur route GT-1000 7 de Asics - Hommes,109.99,mec,Asics
37,Chaussures Margarita de Scarpa - Hommes,169.95,mec,Scarpa
38,Chaussures imperméables Phil Mid de Forsake - Hommes,174.95,mec,Forsake
39,Chaussures de course Fresh Foam Hierro v5 de New Balance - Hommes,179.95,mec,New Balance
40,Chaussures de courte randonnée Kaha GTX de Hoka One One - Hommes,289.95,mec,Other
41,Chaussures de course Wave Rider GTX de Mizuno - Hommes,113.97,mec,Other
42,Chaussures de course Oribi5 BUGrip Traction de Icebug - Hommes,136.47,mec,Other
43,Chaussures de sport Soft 7 Tred GORE-TEX de Ecco - Hommes,157.47,mec,Other
44,Chaussures de courte randonnée Aerios FL Mid GTX de Arc'teryx - Hommes,214.95,mec,Other
45,Chaussures V-Train de Vibram - Hommes,89.97,mec,Other
46,Chaussures d'approche TX2 de La Sportiva - Hommes,139.95,mec,La Sportiva
47,Chaussures imperméables Sawtooth II Mid B-Dry de Oboz - Hommes,199.95,mec,Oboz
48,Chaussures Ohana Li'Ili de Olukai - Hommes,118.97,mec,Other
49,Chaussures de course sur sentier XA Pro 3D de Salomon - Hommes,95.97,mec,Salomon
50,Chaussures de course sur sentier Cascadia 14 de Brooks - Hommes,159.95,mec,Brooks
51,Chaussures de course sur sentier Norvan VT 2 de Arc'teryx - Hommes,189.95,mec,Other
52,Chaussures de course sur sentier Ultra Raptor de La Sportiva - Hommes,149.95,mec,La Sportiva
53,Chaussures de course sur sentier Ultra Pro de Salomon - Hommes,118.97,mec,Salomon
54,Chaussures de course sur route Ghost 12 GTX de Brooks - Hommes,184.95,mec,Brooks
55,Chaussures de course sur route Pulseboost HD de Adidas - Hommes,113.97,mec,Adidas
56,Chaussures Versafoam Excursion TR 13 GTX de Saucony - Hommes,149.95,mec,Saucony
57,Chaussures de course sur route Cloud de On - Hommes,159.95,mec,Other
58,Chaussures Gecko Air de Scarpa - Unisexe,86.67,mec,Scarpa
59,Chaussures de course Wildcat 2.0 GTX de La Sportiva - Hommes,174.95,mec,La Sportiva
60,Chaussures course sentier S/LAB SENSE7 Soft Ground de Salomon - Unisexe,146.97,mec,Salomon
61,Chaussures de course sur sentier Cascadia 14 GTX de Brooks - Hommes,174.95,mec,Brooks
62,Chaussures de courte randonnée Toa GTX de Hoka One One - Hommes,219.95,mec,Other
63,Chaussures de course sur sentier Torrent de Hoka One One - Hommes,159.95,mec,Other
64,Chaussures de courte randonnée Explore Low de Keen - Hommes,97.47,mec,Keen
65,Chaussures de course sur route Ride ISO 2 de Saucony - Hommes,159.95,mec,Saucony
66,Chaussures de course sur sentier Speedgoat 4 GTX de Hoka One One - Hommes,199.95,mec,Other
67,Chaussures de sport Byway de Ecco - Hommes,99.98,mec,Other
68,Chaussures Ascent Ride GORE-TEX de Merrell - Hommes,125.97,mec,Merrel
69,Chaussures de course Peregrine ISO 2 ICE + de Saucony - Hommes,189.95,mec,Saucony
70,Chaussures sans lacets imperméables Na'i de Olukai - Hommes,122.47,mec,Other
71,Chaussures de course sur route Ultraboost 19 de Adidas - Hommes,179.99,mec,Adidas
72,Chaussures de randonnée OUTline Mid GORE-TEX de Salomon - Hommes,179.95,mec,Salomon
73,Chaussures Margarita GTX de Scarpa - Hommes,139.97,mec,Scarpa
74,Chaussures de course sur route Clifton 6 de Hoka One One - Hommes,169.95,mec,Other
75,Chaussures Technician de Black Diamond - Hommes,174.95,mec,Other
76,Chaussures de course sur sentier Lycan de La Sportiva - Hommes,89.0,mec,La Sportiva
77,Chaussures de course Summit Unknown GTX de New Balance - Hommes,169.95,mec,New Balance
78,Chaussures de course sur sentier Peregrine 8 GTX de Saucony - Hommes,179.95,mec,Saucony
79,Chaussures de course sur sentier Summit K.O.M. de New Balance - Hommes,154.95,mec,New Balance
80,Chaussures de courte randonnée OUT GORE-TEX Pro de Salomon - Hommes,209.95,mec,Salomon
81,Chaussures de randonnée légère Spire GTX Surround de La Sportiva - Hommes,209.95,mec,La Sportiva
82,Chaussures course sur route Odyssey React Flyknit2 de Nike - Hommes,95.97,mec,Nike
83,Chaussures de course sur route Phantom de Topo Athletic - Hommes,189.95,mec,Other
84,Chaussures sans lacets Livingston Low de Oboz - Hommes,139.95,mec,Oboz
85,Chaussures de course Fresh Foam Zante Pursuit de New Balance - Hommes,89.97,mec,New Balance
86,Chaussures de course Fresh Foam Crag Trail v2 de New Balance - Hommes,109.95,mec,New Balance
87,Chaussures de course sur route Solardrive de Adidas - Hommes,83.17,mec,Adidas
88,Chaussures sans lacets Jungle Moc 2.0 de Merrell - Hommes,97.97,mec,Merrel
89,Chaussures de course Terraultra G260 Graphene Grip de Inov-8 - Unisexe,139.97,mec,Other
90,Chaussures sans lacets Nohea Lole de Olukai - Hommes,69.97,mec,Other
91,Chaussures imperméables Cloudflyer Reflective de On - Hommes,219.95,mec,Other
92,Chaussures imperméables Clyde II de Forsake - Hommes,84.98,mec,Forsake
93,Chaussures de course React Infinity Run Flyknit de Nike - Hommes,214.95,mec,Nike
94,Chaussures de sport Soft 7 de Ecco - Hommes,209.95,mec,Other
95,Chaussures de course sur sentier Sense Ride 2 de Salomon - Hommes,89.97,mec,Salomon
96,Chaussures course sur sentier imper Cloudventure de On - Hommes,209.95,mec,Other
97,Chaussures de course NewRun BUGrip Traction de Icebug - Hommes,136.47,mec,Other
98,Chaussures de course sur route Wave Inspire 15 de Mizuno - Hommes,101.97,mec,Other
99,Bottes de randonnée Quest Prime GTX de Salomon - Hommes,169.0,mec,Salomon
100,Chaussures de course sur sentier Terraventure de Topo Athletic - Hommes,199.95,mec,Other
101,Chaussures nautiques Ogopogo en néoprène de MEC - Unisexe,49.95,mec,Other
102,Chaussures de course sur sentier XA Elevate 2 GTX de Salomon - Hommes,125.97,mec,Salomon
103,Chaussures de course sur sentier Cloudventure de On - Hommes,189.95,mec,Other
104,Chaussures de course sur route Freedom 3 de Saucony - Hommes,189.95,mec,Saucony
105,Chaussures d'entraînement Fresh Foam Zante de New Balance - Hommes,119.95,mec,New Balance
106,Chaussures chukkas Davis Square cuir et tissu de Timberland - Hommes,99.95,mec,Other
107,Chaussures d'approche Crux de Scarpa - Hommes,179.95,mec,Scarpa
108,Chaussures chukkas Phil de Forsake - Hommes,159.95,mec,Forsake
109,Chaussures de course sur route Free RN 5.0 de Nike - Hommes,80.97,mec,Nike
110,Chaussures de course sur route Solvi V2 de New Balance - Hommes,139.95,mec,New Balance
111,Chaussures de course sur route Wave Rider 23 de Mizuno - Hommes,169.95,mec,Other
112,Chaussures course sur sentier Air Zoom Pegasus 36 de Nike - Hommes,169.95,mec,Nike
113,Chaussures de course sur route Cloudflow de On - Hommes,169.95,mec,Other
114,Chaussures de course sur route Sonic RA 2 Nocturne de Salomon - Hommes,113.97,mec,Salomon
115,Chaussures de course sur sentier Kaptiva de La Sportiva - Hommes,159.95,mec,La Sportiva
116,Chaussures de course sur sentier V-Trail 2.0 de Vibram - Hommes,164.95,mec,Other
117,Chaussures d'approche TX 3 de La Sportiva - Hommes,159.95,mec,La Sportiva
118,Chaussures de course Gel-Kayano 26 Lite-Show 2.0 de Asics - Hommes,153.97,mec,Asics
119,Chaussures de course sur sentier XA Pro 3D v8 de Salomon - Hommes,169.95,mec,Salomon
120,Chaussures Semnoz III de Saola - Hommes,75.0,mec,Other
121,Chaussures de randonnée imperméables Venture Mid de Keen - Hommes,153.97,mec,Keen
122,Chaussures de course sur sentier Hydroventure 2 de Topo Athletic - Hommes,153.97,mec,Other
123,Chaussures de course sur sentier Peregrine ISO de Saucony - Hommes,104.97,mec,Saucony
124,Chaussures de course sur sentier Alphacross GTX de Salomon - Hommes,90.97,mec,Salomon
125,Chaussures d'entraînement F-Lite G 290 de Inov-8 - Unisexe,146.97,mec,Other
126,Chaussures d'entraînement Minimus 20v7 de New Balance - Hommes,129.95,mec,New Balance
127,Chaussures Nova Canvas de Veja - Unisexe,83.97,mec,Other
128,Chaussures nautiques Surfwalker Pro Mesh de Speedo - Hommes,29.95,mec,Other
129,Chaussures de course sur sentier Cloudventure Peak de On - Hommes,132.97,mec,Other
130,Chaussures de course Fresh Foam Roav V2 de New Balance - Hommes,76.97,mec,New Balance
131,Chaussures de course sur sentier MTL Astrum Winter de Merrell - Hommes,119.97,mec,Merrel
132,Chaussures de courte randonnée Outbound de Salomon - Hommes,119.95,mec,Salomon
133,Chaussures Cruzer Psyche de Evolv - Hommes,119.0,mec,Other
134,Chaussures de course sur sentier S/LAB Ultra de Salomon - Unisexe,219.95,mec,Salomon
135,Chaussures course sentier S/LAB SENSE 8 Soft de Salomon - Unisexe,219.95,mec,Salomon
136,Chaussures de course sur sentier X-Talon 255 de Inov-8 - Hommes,219.95,mec,Other
137,Chaussures de course sur route Guide ISO 2 de Saucony - Hommes,101.97,mec,Saucony
138,Chaussures d'entraînement Bare-XF 210 V2 de Inov-8 - Hommes,97.97,mec,Other
139,Chaussures 574 v2 de New Balance - Hommes,109.95,mec,New Balance
140,Chaussures Acro de Salomon - Hommes,111.97,mec,Salomon
141,Chaussures de course sur sentier Speedgoat 4 de Hoka One One - Hommes,189.95,mec,Other
142,Chaussures d'approche Mescalito Mid GORE-TEX de Scarpa - Hommes,181.97,mec,Scarpa
143,Chaussures Mexico 66 de Onitsuka Tiger - Unisexe,89.99,mec,Other
144,Chaussures amphibies Amphib Bold de Salomon - Hommes,77.97,mec,Salomon
145,Chaussures Oxford imperméables Grixsen de Columbia - Hommes,83.97,mec,Other
146,Chaussures d'approche Boulder X de La Sportiva - Hommes,129.95,mec,La Sportiva
147,Chaussures d'entraînement Metcon 5 de Nike - Unisexe,169.95,mec,Nike
148,Chaussures de course sur sentier Snowspike de Salomon - Hommes,160.97,mec,Salomon
149,Chaussures de courte randonnée MQM Flex GORE-TEX de Merrell - Hommes,75.98,mec,Merrel
150,Chaussures imperméables Backpedal Outdry de Columbia - Hommes,77.97,mec,Other
151,Chaussures de course sur sentier Superior 4 de Altra - Hommes,159.95,mec,Altra
152,Chaussures de course sur sentier Gel-Sonoma 4 de Asics - Hommes,76.97,mec,Asics
153,Chaussures d'entraînement Free X Metcon 2 de Nike - Hommes,159.95,mec,Nike
154,Chaussures de course sur sentier XA Wild de Salomon - Hommes,159.95,mec,Salomon
155,Chaussures de course Adizero Boston Boost 8 de Adidas - Hommes,159.95,mec,Adidas
156,Chaussures de course sur sentier Cascadia 14 de Brooks - Hommes,159.95,mec,Brooks
157,Chaussures de course Mudclaw G 260 Graphene Grip de Inov-8 - Unisexe,139.97,mec,Other
158,Chaussures FiveFingers V-Aqua de Vibram - Hommes,139.95,mec,Other
159,Chaussures en toile Sharkbyte de Xtratuf - Hommes,47.97,mec,Other
160,Chaussures de course Roclite 335 PrimaLoft de Inov-8 - Unisexe,136.47,mec,Other
161,Chaussures de course sur route Alphabounce+ Parley de Adidas - Hommes,62.37,mec,Adidas
162,Chaussures de randonnée Ultra Fastpack III GTX de The North Face - Hommes,132.99,mec,North Face
163,Chaussures imperméables Driggs de Forsake - Hommes,65.0,mec,Forsake
164,Chaussures en toile de coton biologique Wata Vegan de Veja - Unisexe,89.99,mec,Other
165,Chaussures de courte randonnée Mantra 2.0 de Vasque - Hommes,100.77,mec,Other
166,Chaussures Semnoz II Recycled Vegan de Saola - Hommes,64.5,mec,Other
167,Chaussures de randonnée légère Voyageur de Keen - Hommes,139.95,mec,Keen
168,Chaussures Oxford Brooklyn en tissu de Timberland - Hommes,109.95,mec,Other
169,Chaussures Landis 2 TX de Reef - Hommes,59.99,mec,Other
170,Chaussures de course sur sentier Xodus ISO 3 de Saucony - Hommes,107.97,mec,Saucony
171,Chaussures de randonnée légère Targhee EVO Mid de Keen - Hommes,99.98,mec,Keen
172,Chaussures de course sur route Adizero RC de Adidas - Unisexe,97.46,mec,Adidas
173,Chaussures de course sur sentier Corvara de The North Face - Hommes,95.99,mec,North Face
174,Chaussures de course sur sentier Flight Trinity de The North Face - Hommes,95.0,mec,North Face
175,Chaussures de course sur route 870 v5 de New Balance - Hommes,149.95,mec,New Balance
176,Chaussures Baikal de Saola - Hommes,90.0,mec,Other
177,Chaussures de course sur sentier XA Pro 3D de Salomon - Hommes,95.97,mec,Salomon
178,Chaussures imperméables Brock de UGG - Hommes,87.47,mec,Other
179,Chaussures Backpedal Clime Outdry de Columbia - Hommes,83.97,mec,Other
180,Chaussures en toile Sharkbyte de Xtratuf - Hommes,47.97,mec,Other
181,Chaussures de courte randonnée MQM Flex GORE-TEX de Merrell - Hommes,75.98,mec,Merrel
182,Chaussures de course sur route Ride ISO de Saucony - Hommes,95.97,mec,Saucony
183,Chaussures de course sur sentier Cascadia 13 de Brooks - Hommes,99.0,mec,Brooks
184,Chaussures de course sur sentier Gel-Sonoma 4 de Asics - Hommes,76.97,mec,Asics
185,Mocassins en caoutchouc de L.L. Bean - Hommes,75.0,mec,Other
186,Chaussures Cordura 997H de New Balance - Hommes,71.97,mec,New Balance
187,Chaussures de course sur sentier Switchback ISO de Saucony - Hommes,169.95,mec,Saucony
188,Chaussures course sentier S/LAB SENSE 8 Soft de Salomon - Unisexe,219.95,mec,Salomon
189,Chaussures de course sur sentier XA Elevate de Salomon - Hommes,111.75,mec,Salomon
190,Chaussures de course sur sentier Flight Trinity de The North Face - Hommes,95.0,mec,North Face
191,Chaussures Semnoz II Recycled Vegan de Saola - Hommes,64.5,mec,Other
192,Chaussures Baikal de Saola - Hommes,90.0,mec,Other
193,Chaussures de course sur sentier Speedgoat 4 de Hoka One One - Hommes,189.95,mec,Other
194,Chaussures de course sur route STRATA 3 de 361 Degrees - Hommes,99.98,mec,Other
195,Chaussures de course sur sentier Parkclaw 240 Knit de Inov-8 - Hommes,87.0,mec,Other
196,Chaussures de course sur route Solar Glide de Adidas - Hommes,179.95,mec,Adidas
197,Chaussures mi-hautes Spiniker Nb de Reef - Hommes,59.0,mec,Other
198,Chaussures de course Air Zoom Pegasus 36 Shield de Nike - Hommes,164.95,mec,Nike
199,Chaussures de course sur sentier XA Wild de Salomon - Hommes,159.95,mec,Salomon
200,Bottes de randonnée imperméables Garrison Trail basses de Timberland - Hommes,159.95,mec,Other
201,Chaussures de course Adizero Boston Boost 8 de Adidas - Hommes,159.95,mec,Adidas
202,Chaussures de course sur sentier YUSHAN de 361 Degrees - Hommes,84.98,mec,Other
203,Chaussures Grovler 2 Natural de Reef - Hommes,48.95,mec,Other
204,Chaussures de course sur route Ricochet 2 de Brooks - Hommes,149.95,mec,Brooks
205,Chaussures Conspiracy III Titanium Outdry de Columbia - Hommes,109.0,mec,Other
206,Chaussures 997H de New Balance - Hommes,119.95,mec,New Balance
207,Chaussures Landis 2 TX de Reef - Hommes,59.99,mec,Other
208,Chaussures de randonnée légère Targhee EVO Mid de Keen - Hommes,99.98,mec,Keen
209,Chaussures de course sur sentier Bare Access Flex2 de Merrell - Hommes,71.97,mec,Merrel
210,Chaussures The Phillips de People Footwear - Unisexe,29.0,mec,Other
211,Chaussures de randonnée imperméables Targhee EXP Mid de Keen - Hommes,119.0,mec,Keen
212,Chaussures de courte randonnée imp.Moab FST de Merrell - Hommes,109.0,mec,Merrel
213,Chaussures basses Sawtooth de Oboz - Hommes,112.0,mec,Oboz
214,Chaussures basses Tuckerman de Timberland - Hommes,89.99,mec,Other
215,Chaussures de randonnée légère mi-hautes imperméables MQMAce de Merrell - Hommes,159.99,mec,Merrel
216,Chaussures de course sur sentier SpeedGoat 2 de Hoka - Hommes,139.0,mec,Other
217,Chaussures de course sur sentier Spin Ultra de Scarpa - Hommes,149.96,mec,Scarpa
218,Chaussures de course sur route Adizero Adios de Adidas - Hommes,129.0,mec,Adidas
219,Chaussures de course sur route Launch 4 de Brooks - Hommes,100.0,mec,Brooks
220,Chaussures Alvarado de Onitsuka Tiger - Unisexe,80.0,mec,Other
221,Chaussures de course route Adizero Boston Boost 7 de Adidas - Hommes,109.99,mec,Adidas
222,Chaussures sans lacets Unio Wharf de Timberland - Hommes,59.95,mec,Other
223,Chaussures Ascent Valley de Merrell - Hommes,97.97,mec,Merrel
224,Chaussures sans lacets Cadman Moc Knit de The North Face - Hommes,70.0,mec,North Face
225,Chaussures Landis 2 Natural de Reef - Hommes,59.99,mec,Other
226,Bottes de courte randonnée Saber GORE-TEX de La Sportiva - Hommes,209.95,mec,La Sportiva
227,Chaussures de course Sense Ride 3 GTX InvisibleFit de Salomon - Hommes,199.95,mec,Salomon
228,Chaussures de course sur sentier Sense Pro 4 de Salomon - Hommes,169.95,mec,Salomon
229,Chaussures de course sur sentier Sense Flow GORE-TEX de Salomon - Hommes,159.95,mec,Salomon
230,Chaussures de courte randonnée X Raise GORE-TEX de Salomon - Hommes,159.95,mec,Salomon
231,Chaussures de courte randonnée X Raise de Salomon - Hommes,139.95,mec,Salomon
232,Chaussures d'entraînement Move Glove de Merrell - Hommes,139.95,mec,Merrel
233,Chaussures sans lacets Jungle Moc de Merrell - Hommes,109.05,mec,Merrel
234,Chaussures Peregrine 10 Invisible Fit GTX de Saucony - Hommes,179.95,mec,Saucony
235,Chaussures de course sur route Kinvara 11 de Saucony - Hommes,139.95,mec,Saucony
236,Chaussures de course sur route Cloudstratus de On - Hommes,219.95,mec,Other
237,Chaussures de course sur route Cloudswift de On - Hommes,189.95,mec,Other
238,Chaussures de course sur sentier Terrex Skychaser de Adidas - Hommes,179.95,mec,Adidas
239,Chaussures de course Terrex Agravic LT GTX de Adidas - Hommes,129.95,mec,Adidas
240,Chaussures de course sur route Adizero RC 2 de Adidas - Hommes,129.95,mec,Adidas
241,Chaussures de course sur route Fresh Foam 1080v10 de New Balance - Hommes,209.95,mec,New Balance
242,Chaususres de course sur sentier MTL Long Sky de Merrell - Hommes,169.95,mec,Merrel
243,Chaussures de course MTL Skyfire Invisible Fit GTX de Merrell - Hommes,159.95,mec,Merrel
244,Chaussures de course sur sentier MTL Skyfire de Merrell - Hommes,129.95,mec,Merrel
245,Chaussures de course sur sentier Trail Glove 5 Eco de Merrell - Hommes,159.95,mec,Merrel
246,Chaussures de randonnée Activist FUTURELIGHT de The North Face - Hommes,179.99,mec,North Face
247,Chaussures Ultra Fastpack IV FUTURELIGHT Mid de The North Face - Hommes,199.99,mec,North Face
248,Chaussures de courte randonnée Ultra Fastpack IV FUTURELIGHT de The North Face - Hommes,189.99,mec,North Face
249,Chaussures de randonnée imperméables Ultra 111 de The North Face - Hommes,159.99,mec,North Face
250,Chaussures de course Ultra Traction FUTURELIGHT de The North Face - Hommes,199.99,mec,North Face
251,Chaussures de course sur route GT-2000 8 Lite-Show de Asics - Hommes,169.95,mec,Asics
252,Chaussures de course Gel-Nimbus 22 Lite-Show de Asics - Hommes,199.95,mec,Asics
253,Chaussures d'entraînement V-Alpha de Vibram - Hommes,164.95,mec,Other
254,Chaussures Wata Recycled BMESH de Veja - Unisexe,86.25,mec,Other
255,Chaussures de courte randonnée Explore Mid de Keen - Hommes,159.95,mec,Keen
256,Chaussures de course sur sentier Divide de Brooks - Hommes,159.95,mec,Brooks
257,Chaussures de courte randonnée Arete Low B-Dry de Oboz - Hommes,199.95,mec,Oboz
258,Chaussures de courte randonnée Arete Low de Oboz - Hommes,154.95,mec,Oboz
259,Chaussures de randonnée Arete Mid B-Dry de Oboz - Hommes,199.95,mec,Oboz
260,Chaussures de course sur route Dynaflyte 3 Sound de Asics - Hommes,79.0,mec,Asics
261,Chaussures de course sur sentier Nova de Merrell - Hommes,74.98,mec,Merrel
262,Chaussures sans lacets Barkley de Merrell - Hommes,89.99,mec,Merrel
263,Chaussures de course sur sentier XA Wild GORE-TEX de Salomon - Hommes,189.95,mec,Salomon
264,Chaussures de course sur route Levitate 2 de Brooks - Hommes,189.95,mec,Brooks
